{
  "record_type": "scanalyze.platform_authority.gug365_upstream_phase_authorization.v1",
  "schema_version": 1,
  "implementation_issue": "GUG-376",
  "upstream_issue": "GUG-376",
  "consumer_issue": "GUG-365",
  "environment": "authority-non-production",
  "production": false,
  "production_authorized": false,
  "production_status": "NO-GO",
  "deployment_authorized": false,
  "consumer_writes_authorized": false,
  "decision": "STOP",
  "state": "STOP_UPSTREAM_SOURCE_CONTRACT_GAP",
  "owner_authorization_issued": false,
  "phase": "IDENTITY_CENTER_FOUNDATION",
  "source_head_sha": "51cfbb5d8912bf4a300ae5f258b4ccc250d2f4b4",
  "source_merge_sha": "a1999d0f9a885a98e443a5c8e9d4c9f7dba04d86",
  "source_tree_sha": "0a1171aae5c3fb8ccb8c7e62cbfbd780f91c700e",
  "gap_checkpoint_digest": "sha256:9e1ad097fe1f7dfd98ed267bcf2c0aaa4e0a3a92344d589d7e4357c1894bc5d3",
  "aws_calls_performed": 0,
  "aws_mutations": 0,
  "gug365_aws_writes": 0,
  "gug357_create_stack": 0,
  "gug215_effects": 0,
  "gug206_effects": 0,
  "missing_source_contracts": [
    "IDENTITY_CENTER_PROVIDER_OUTPUT_POLLING",
    "IDENTITY_CENTER_PROVISIONED_ROLE_ARN_CAUSALITY",
    "KMS_ARTIFACT_USE_POLICY",
    "S3_ARTIFACT_BUCKET_POLICY",
    "SIGNER_DESTINATION_POLICY_AND_RESULT_PROJECTION",
    "LIVE_PRIVATE_ORCHESTRATOR"
  ],
  "next_action": "MATERIALIZE_REVIEWED_SOURCE_CONTRACTS",
  "created_at": "2026-08-13T20:00:00Z",
  "checkpoint_digest": "sha256:d19e3e570d0ee3899b174bd5831f25b974c2f949bbebaf848eea20ba61b41c9a"
}
